Statlean/Web/jobmofvoxwsav8y/raw/input/hybrid_auto/input_content_list.json

[
    {
        "type": "text",
        "text": "If $Z$ is not of full rank, then there are infinitely many LSE’s of $\\beta$ . It can be shown (exercise) that any LSE of $\\beta$ is of the form ",
        "bbox": [
            123,
            97,
            870,
            135
        ],
        "page_idx": 0
    },
    {
        "type": "equation",
        "text": "$$\n\\hat {\\beta} = \\left(Z ^ {\\tau} Z\\right) ^ {-} Z ^ {\\tau} X, \\tag {3.29}\n$$",
        "text_format": "latex",
        "bbox": [
            407,
            147,
            865,
            166
        ],
        "page_idx": 0
    },
    {
        "type": "text",
        "text": "where $( Z ^ { \\tau } Z ) ^ { - }$ is called a generalized inverse of $Z ^ { \\tau } Z$ and satisfies ",
        "bbox": [
            123,
            175,
            781,
            193
        ],
        "page_idx": 0
    },
    {
        "type": "equation",
        "text": "$$\nZ ^ {\\tau} Z (Z ^ {\\tau} Z) ^ {-} Z ^ {\\tau} Z = Z ^ {\\tau} Z.\n$$",
        "text_format": "latex",
        "bbox": [
            369,
            202,
            624,
            223
        ],
        "page_idx": 0
    },
    {
        "type": "text",
        "text": "Generalized inverse matrices are not unique unless $Z$ is of full rank, in which case $( Z ^ { \\tau } Z ) ^ { - } = ( Z ^ { \\tau } Z ) ^ { - 1 }$ and (3.29) reduces to (3.28). ",
        "bbox": [
            123,
            232,
            870,
            270
        ],
        "page_idx": 0
    },
    {
        "type": "text",
        "text": "To study properties of LSE’s of $\\beta$ , we need some assumptions on the distribution of $X$ . Since $Z _ { i }$ ’s are nonrandom, assumptions on the distribution of $X$ can be expressed in terms of assumptions on the distribution of $\\varepsilon$ . Several commonly adopted assumptions are stated as follows. ",
        "bbox": [
            123,
            273,
            870,
            345
        ],
        "page_idx": 0
    },
    {
        "type": "text",
        "text": "Assumption A1: $\\varepsilon$ is distributed as $N _ { n } ( 0 , \\sigma ^ { 2 } I _ { n } )$ with an unknown $\\sigma ^ { 2 } > 0$ . ",
        "bbox": [
            125,
            355,
            861,
            376
        ],
        "page_idx": 0
    },
    {
        "type": "text",
        "text": "Assumption A2: $E ( \\varepsilon ) = 0$ and $\\mathrm { V a r } ( \\varepsilon ) = \\sigma ^ { 2 } I _ { n }$ with an unknown $\\sigma ^ { 2 } > 0$ . ",
        "bbox": [
            125,
            379,
            840,
            399
        ],
        "page_idx": 0
    },
    {
        "type": "text",
        "text": "Assumption A3: $E ( \\varepsilon ) = 0$ and $\\mathrm { V a r } ( \\varepsilon )$ is an unknown matrix. ",
        "bbox": [
            125,
            402,
            735,
            421
        ],
        "page_idx": 0
    },
    {
        "type": "text",
        "text": "Assumption A1 is the strongest and implies a parametric model. We may assume a slightly more general assumption that $\\varepsilon$ has the $N _ { n } ( 0 , \\sigma ^ { 2 } D )$ distribution with unknown $\\sigma ^ { 2 }$ but a known positive definite matrix $D$ . Let $D ^ { - 1 / 2 }$ be the inverse of the square root matrix of $D$ . Then model (3.25) with assumption A1 holds if we replace $X$ , $Z$ , and $\\varepsilon$ by the transformed variables $\\ddot { X } = D ^ { - 1 / 2 } X$ , $\\ddot { Z } = D ^ { - 1 / 2 } Z$ , and $\\tilde { \\varepsilon } = D ^ { - 1 / 2 } \\varepsilon$ , respectively. A similar conclusion can be made for assumption A2. ",
        "bbox": [
            123,
            432,
            870,
            558
        ],
        "page_idx": 0
    },
    {
        "type": "text",
        "text": "Under assumption A1, the distribution of $X$ is $N _ { n } ( Z \\beta , \\sigma ^ { 2 } I _ { n } )$ , which is in an exponential family $\\mathcal { P }$ with parameter $\\theta = ( \\beta , \\sigma ^ { 2 } ) \\in \\mathcal { R } ^ { p } \\times ( 0 , \\infty )$ . However, if the matrix $Z$ is not of full rank, then $\\mathcal { P }$ is not identifiable (see 2.1.2), since $Z \\beta _ { 1 } = Z \\beta _ { 2 }$ does not imply $\\beta _ { 1 } = \\beta _ { 2 }$ . ",
        "bbox": [
            123,
            561,
            870,
            636
        ],
        "page_idx": 0
    },
    {
        "type": "text",
        "text": "Suppose that the rank of $Z$ is $r \\le p$ . Then there is an $n \\times r$ submatrix $Z _ { * }$ of $Z$ such that ",
        "bbox": [
            125,
            639,
            870,
            672
        ],
        "page_idx": 0
    },
    {
        "type": "equation",
        "text": "$$\nZ = Z _ {*} Q \\tag {3.30}\n$$",
        "text_format": "latex",
        "bbox": [
            453,
            675,
            865,
            693
        ],
        "page_idx": 0
    },
    {
        "type": "text",
        "text": "and $Z _ { * }$ is of rank $r$ , where $Q$ is a fixed $r \\times p$ matrix. Then ",
        "bbox": [
            123,
            699,
            715,
            717
        ],
        "page_idx": 0
    },
    {
        "type": "equation",
        "text": "$$\nZ \\beta = Z _ {*} Q \\beta\n$$",
        "text_format": "latex",
        "bbox": [
            435,
            726,
            560,
            747
        ],
        "page_idx": 0
    },
    {
        "type": "text",
        "text": "and $\\mathcal { P }$ is identifiable if we consider the reparameterization $\\bar { \\beta } = Q \\beta$ . Note that the new parameter $\\tilde { \\beta }$ is in a subspace of $\\mathcal { R } ^ { p }$ with dimension $r$ . ",
        "bbox": [
            123,
            755,
            870,
            792
        ],
        "page_idx": 0
    },
    {
        "type": "text",
        "text": "In many applications, we are interested in estimating some linear functions of $\\beta$ , i.e., $\\vartheta = l ^ { \\tau } \\beta$ for some $l \\in \\mathcal { R } ^ { p }$ . From the previous discussion, however, estimation of $l ^ { \\tau } \\beta$ is meaningless unless $l = Q ^ { \\tau } c$ for some $c \\in \\mathcal { R } ^ { r }$ so that ",
        "bbox": [
            123,
            795,
            870,
            866
        ],
        "page_idx": 0
    },
    {
        "type": "equation",
        "text": "$$\nl ^ {\\tau} \\beta = c ^ {\\tau} Q \\beta = c ^ {\\tau} \\tilde {\\beta}.\n$$",
        "text_format": "latex",
        "bbox": [
            400,
            866,
            596,
            887
        ],
        "page_idx": 0
    },
    {
        "type": "header",
        "text": "3.3. The LSE in Linear Models ",
        "bbox": [
            125,
            46,
            441,
            63
        ],
        "page_idx": 0
    },
    {
        "type": "page_number",
        "text": "183 ",
        "bbox": [
            831,
            48,
            870,
            63
        ],
        "page_idx": 0
    },
    {
        "type": "text",
        "text": "The following result shows that $l ^ { \\tau } \\beta$ is estimable if ${ \\mathit { l } } = Q ^ { \\tau } c$ , which is also necessary for $l ^ { \\tau } \\beta$ to be estimable under assumption A1. ",
        "bbox": [
            123,
            99,
            870,
            136
        ],
        "page_idx": 1
    },
    {
        "type": "text",
        "text": "Theorem 3.6. Assume model (3.25) with assumption A3. ",
        "bbox": [
            123,
            151,
            715,
            169
        ],
        "page_idx": 1
    },
    {
        "type": "text",
        "text": "(i) A necessary and sufficient condition for $l ~ \\in ~ \\mathcal { R } ^ { p }$ being $Q ^ { \\tau } c$ for some $c \\in \\mathcal { R } ^ { r }$ is $l \\in \\mathcal { R } ( Z ) = \\mathcal { R } ( Z ^ { \\tau } Z )$ , where $Q$ is given by (3.30) and $\\mathcal { R } ( A )$ is the smallest linear subspace containing all rows of $A$ . ",
        "bbox": [
            123,
            171,
            870,
            223
        ],
        "page_idx": 1
    },
    {
        "type": "text",
        "text": "(ii) If $l \\in \\mathcal { R } ( Z )$ , then the LSE $l ^ { \\tau } \\hat { \\beta }$ is unique and unbiased for $l ^ { \\tau } \\beta$ . ",
        "bbox": [
            123,
            225,
            781,
            241
        ],
        "page_idx": 1
    },
    {
        "type": "text",
        "text": "(iii) If $l \\not \\in \\mathcal { R } ( Z )$ and assumption A1 holds, then $l ^ { \\tau } \\beta$ is not estimable. ",
        "bbox": [
            123,
            243,
            810,
            259
        ],
        "page_idx": 1
    },
    {
        "type": "text",
        "text": "Proof. (i) Note that $a \\in { \\mathcal { R } } ( A )$ if and only if $a = A ^ { \\tau } b$ for some vector $b$ . If $l = Q ^ { \\prime } c$ , then ",
        "bbox": [
            123,
            259,
            870,
            295
        ],
        "page_idx": 1
    },
    {
        "type": "equation",
        "text": "$$\nl = Q ^ {\\tau} c = Q ^ {\\tau} Z _ {*} ^ {\\tau} Z _ {*} (Z _ {*} ^ {\\tau} Z _ {*}) ^ {- 1} c = Z ^ {\\tau} [ Z _ {*} (Z _ {*} ^ {\\tau} Z _ {*}) ^ {- 1} c ].\n$$",
        "text_format": "latex",
        "bbox": [
            239,
            307,
            753,
            331
        ],
        "page_idx": 1
    },
    {
        "type": "text",
        "text": "Hence $l \\in \\mathcal { R } ( Z )$ . If $l \\in \\mathcal { R } ( Z )$ , then $l = Z ^ { \\tau } \\zeta$ for some $\\zeta$ and ",
        "bbox": [
            123,
            342,
            715,
            361
        ],
        "page_idx": 1
    },
    {
        "type": "equation",
        "text": "$$\nl = \\left(Z _ {*} Q\\right) ^ {\\tau} \\zeta = Q ^ {\\tau} c\n$$",
        "text_format": "latex",
        "bbox": [
            396,
            373,
            599,
            393
        ],
        "page_idx": 1
    },
    {
        "type": "text",
        "text": "with $c = Z _ { * } ^ { \\tau } \\zeta$ . ",
        "bbox": [
            123,
            406,
            268,
            423
        ],
        "page_idx": 1
    },
    {
        "type": "text",
        "text": "(ii) If $l \\in \\mathcal { R } ( Z ) = \\mathcal { R } ( Z ^ { \\tau } Z )$ , then $l = Z ^ { \\tau } Z \\zeta$ for some $\\zeta$ and by (3.29), ",
        "bbox": [
            125,
            424,
            813,
            442
        ],
        "page_idx": 1
    },
    {
        "type": "equation",
        "text": "$$\n\\begin{array}{l} E \\left(l ^ {\\tau} \\hat {\\beta}\\right) = E \\left[ l ^ {\\tau} \\left(Z ^ {\\tau} Z\\right) ^ {-} Z ^ {\\tau} X \\right] \\\\ = \\zeta^ {\\tau} Z ^ {\\tau} Z \\left(Z ^ {\\tau} Z\\right) ^ {-} Z ^ {\\tau} Z \\beta \\\\ = \\zeta^ {\\tau} Z ^ {\\tau} Z \\beta \\\\ = l ^ {\\tau} \\beta . \\\\ \\end{array}\n$$",
        "text_format": "latex",
        "bbox": [
            343,
            456,
            651,
            540
        ],
        "page_idx": 1
    },
    {
        "type": "text",
        "text": "If $\\beta$ is any other LSE of $\\beta$ , then, by (3.27), ",
        "bbox": [
            123,
            555,
            558,
            576
        ],
        "page_idx": 1
    },
    {
        "type": "equation",
        "text": "$$\nl ^ {\\tau} \\hat {\\beta} - l ^ {\\tau} \\bar {\\beta} = \\zeta^ {\\tau} (Z ^ {\\tau} Z) (\\hat {\\beta} - \\bar {\\beta}) = \\zeta^ {\\tau} (Z ^ {\\tau} X - Z ^ {\\tau} X) = 0.\n$$",
        "text_format": "latex",
        "bbox": [
            227,
            587,
            765,
            609
        ],
        "page_idx": 1
    },
    {
        "type": "text",
        "text": "(iii) Under assumption A1, if there is an estimator $h ( X , Z )$ unbiased for $l ^ { \\tau } \\beta$ , then ",
        "bbox": [
            123,
            621,
            870,
            657
        ],
        "page_idx": 1
    },
    {
        "type": "equation",
        "text": "$$\nl ^ {\\tau} \\beta = \\int_ {\\mathcal {R} ^ {n}} h (x, Z) (2 \\pi) ^ {- n / 2} \\sigma^ {- n} \\exp \\left\\{- \\frac {1}{2 \\sigma^ {2}} \\| x - Z \\beta \\| ^ {2} \\right\\} d x.\n$$",
        "text_format": "latex",
        "bbox": [
            209,
            669,
            783,
            710
        ],
        "page_idx": 1
    },
    {
        "type": "text",
        "text": "Differentiating w.r.t. $\\beta$ and applying Theorem 2.1 lead to ",
        "bbox": [
            123,
            717,
            703,
            737
        ],
        "page_idx": 1
    },
    {
        "type": "equation",
        "text": "$$\nl = Z ^ {\\tau} \\int_ {\\mathcal {R} ^ {n}} h (x, Z) (2 \\pi) ^ {- n / 2} \\sigma^ {- n - 2} (x - Z \\beta) \\exp \\left\\{- \\frac {1}{2 \\sigma^ {2}} \\| x - Z \\beta \\| ^ {2} \\right\\} d x,\n$$",
        "text_format": "latex",
        "bbox": [
            148,
            747,
            842,
            786
        ],
        "page_idx": 1
    },
    {
        "type": "text",
        "text": "which implies $l \\in \\mathcal { R } ( Z )$ . ",
        "bbox": [
            123,
            797,
            366,
            816
        ],
        "page_idx": 1
    },
    {
        "type": "text",
        "text": "Theorem 3.6 shows that LSE’s are unbiased for estimable parameters $l ^ { \\tau } \\beta$ . If $Z$ is of full rank, then $\\mathcal { R } ( Z ) = \\mathcal { R } ^ { p }$ and, therefore, $l ^ { \\tau } \\beta$ is estimable for any $l \\in \\mathcal { R } ^ { p }$ . ",
        "bbox": [
            123,
            831,
            870,
            887
        ],
        "page_idx": 1
    },
    {
        "type": "page_number",
        "text": "184 ",
        "bbox": [
            127,
            48,
            166,
            64
        ],
        "page_idx": 1
    },
    {
        "type": "header",
        "text": "3. Unbiased Estimation ",
        "bbox": [
            628,
            48,
            872,
            64
        ],
        "page_idx": 1
    }
]

Statlean/Web/jobmofvoxwsav8y/raw/input/hybrid_auto/input.md

$$
\hat {\beta} = \left(Z ^ {\tau} Z\right) ^ {-} Z ^ {\tau} X, \tag {3.29}
$$

Generalized inverse matrices are not unique unless $Z$ is of full rank, in which case $( Z ^ { \tau } Z ) ^ { - } = ( Z ^ { \tau } Z ) ^ { - 1 }$ and (3.29) reduces to (3.28).

Assumption A1 is the strongest and implies a parametric model. We may assume a slightly more general assumption that $\varepsilon$ has the $N _ { n } ( 0 , \sigma ^ { 2 } D )$ distribution with unknown $\sigma ^ { 2 }$ but a known positive definite matrix $D$ . Let $D ^ { - 1 / 2 }$ be the inverse of the square root matrix of $D$ . Then model (3.25) with assumption A1 holds if we replace $X$ , $Z$ , and $\varepsilon$ by the transformed variables $\ddot { X } = D ^ { - 1 / 2 } X$ , $\ddot { Z } = D ^ { - 1 / 2 } Z$ , and $\tilde { \varepsilon } = D ^ { - 1 / 2 } \varepsilon$ , respectively. A similar conclusion can be made for assumption A2.

(i) A necessary and sufficient condition for $l ~ \in ~ \mathcal { R } ^ { p }$ being $Q ^ { \tau } c$ for some $c \in \mathcal { R } ^ { r }$ is $l \in \mathcal { R } ( Z ) = \mathcal { R } ( Z ^ { \tau } Z )$ , where $Q$ is given by (3.30) and $\mathcal { R } ( A )$ is the smallest linear subspace containing all rows of $A$ .

(ii) If $l \in \mathcal { R } ( Z ) = \mathcal { R } ( Z ^ { \tau } Z )$ , then $l = Z ^ { \tau } Z \zeta$ for some $\zeta$ and by (3.29),

If $\beta$ is any other LSE of $\beta$ , then, by (3.27),